Titulo,Resumen,Fecha,Contenido,Link
Pronabec entregará 10.000 becas para estudios superiores,"La directora del Pronabec, Marushka Chocobar, afirma que el objetivo de la institución es tener ""becarios transformadores""",10.05.2017 / 05:45 pm,"Marushka Chocobar, la nueva cabeza del Pronabec, detalla los ejes de su gestión. Su meta, asegura, será que el país cuente con becarios transformadores. Follow@EconomiaECpe —¿Cuáles serán los lineamientos de su gestión? 
Vamos a desarrollar una política de protección y cuidado integral del becario, porque sin acompañamiento los niveles de deserción se incrementan. Hoy la deserción de los becarios del Pronabec es en promedio un 15% y pretendemos reducirla a un 5%. —¿Qué cambios se harán en la entrega de las becas? 
La segunda política será priorizar las carreras profesionales en las regiones del país. Buscaremos que los becarios se queden en sus regiones y estudien profesiones que atiendan las necesidades de sus comunidades. —¿Pero cómo lo harán si muchos buscan estudiar en Lima en vez de provincias?
Daremos incentivos como puntos adicionales en la postulación a quienes se queden en sus regiones. Actualmente el 50% de becarios en Lima procede de provincias, planeamos reducir esa cifra a un 30% y que un 70% permanezca en sus regiones. Eso debe darse en tres años. —¿Cuántas becas planean entregar este año?
Aproximadamente 10 mil becas. Hemos reorganizado las becas en función de la población. Así Beca 18 contará con 4 mil becas el 2017, mientras que el número de becas para poblaciones vulnerables ascenderá a 1.700. —¿Habrá una política para acortar los plazos para la asignación de las becas? 
Hemos apostado por la simplificación administrativa y se ha fortalecido la atención al ciudadano y los canales digitales. Con estos cambios, los resultados de la primera fecha de corte de Beca 18 se han reducido en tres meses. —Con los cambios que menciona, ¿qué espera alcanzar durante su gestión?
Nuestro objetivo es que al final de nuestros programas de beca tengamos becarios transformadores de su propia vida, de su propia familia, de su comunidad y región. —¿Cuál es el nivel de empleabilidad de los becarios? 
Sobre la base de Beca 18, el 87% ya está insertado en el mercado laboral, un 11% está dedicado a su titulación y otro 2% aún cursa estudios. —¿En qué sector trabajan?
Un 80% en el sector privado y un 20% en el sector público. Para revertir esto, ya estamos suscribiendo acuerdos con gobiernos locales y regionales del país para que tengan su cuota de becarios. —¿El Pronabec requiere un mayor presupuesto? 
En cinco años el presupuesto pasó de 120 a 930 millones de soles. Hemos pedido al MEF que se mantenga este nivel en nuestro plan multianual hasta el 2020. Lee más noticias de Economía...Tweets by EconomiaECpe",https://elcomercio.pe/economia/pronabec-entregara-10-000-becas-estudios-superiores-422977
Beca 18: Número de plazas para realizar estudios universitarios,Conozca el uso de Beca 18 y otras ayudas que el Estado brinda a los jóvenes que acabaron secundaria,08.05.2017 / 09:34 am," El apoyo del Estado Peruano a través de becas a jóvenes de escasos recursos ha posibilitado que ellos estudien en las universidades privadas que figuran entre las más costosas del país, un hecho que las entidades educativas ven con muy buenos ojos. Teresa Braco, directora de Pensiones de la Universidad del Pacífico, indica que actualmente 106 alumnos estudian en la UP, gracias a los programas de becas dados, tanto por el Estado como por entidades privadas. “Tenemos alumnos de Beca 18 y Beca Excelencia Académica del Ministerio de Educación (Minedu), ambas del Estado”, dice Braco, quien destaca sobre todo esta última, pues solo seis instituciones educativas han sido consideradas como receptoras de estos alumnos por el Programa Nacional de Becas (Pronabec). Además, la UP tiene becarios del Gobierno Regional del Callao (primeros alumnos del colegio de alto rendimiento) y del Patronato del BCP y la Beca de la ONG Ankay. En la Universidad de Piura tienen alumnos becados por el Estado a través de sus programas Beca 18, Beca Vocación Maestro y Beca Hijo de Docente. “Nuestra universidad ha sido seleccionada para ofrecer esta propuesta dentro del modelo definido por el Gobierno para que personas de escasos recursos puedan seguir estudios superiores en universidades”, indican sus voceros. María Ángela Paredes, jefa de Bienestar Estudiantil de la Universidad ESAN, apunta que los becarios (de Beca 18 y Beca Excelencia Académica) que estudian en su entidad no son muchos, pero destacan por su excelencia personal: educados, responsables, perseverantes y con un alto grado de motivación, describe. En Pronabec, la directora ejecutiva Marushka Chocobar, indica que desde el 2012 han entregado 58.256 becas. “Este año la cartera es de nueve tipos de becas de pregrado, entre las que se otorgarán más de 5.000 vacantes”, señala. De ese total, 4.000 se otorgarán a través de Beca 18, las demás son Beca 18 internacional (100), Beca Vocación de Maestro (511), Beca G Brasil (20), Beca Francia (20), Beca Permanencia (225), Beca Hijos de Docentes (300) y Beca Alianza del Pacífico (100). CRITERIOS
Cada uno de esos programas tiene distintos requisitos de acceso, indica Chocobar a Día1, pero, en general, los grandes criterios son ser peruano con residencia en el país y haber ingresado a una institución educativa superior elegible en una carrera elegible.
En la asignación de las becas, el Ministerio de Educación (Minedu), a través del Programa Nacional de Becas y Crédito Educativo, tiene cuatro enfoques: inclusión social, poblaciones vulnerables, desarrollo humano y alto rendimiento.
Para ser becado por el Gobierno Peruano a través de sus distintos programas, o por alguna ONG, patronato o entidad internacional los estudiantes deben mostrar un alto nivel educativo y que este sea constante. BECA 18 Actualmente hay una convocatoria abierta para 4.000 becas de Beca 18. Los requisitos para postular son tener un alto rendimiento académico, contar con un registro SISFOH (de vivir en condiciones de pobreza), haber culminado la secundaria entre 2013 y 2017, ser peruano y tener hasta 22 años al 31 de diciembre de 2016.
El Estado entregará más de 5.000 becas de pregrado
Apuesta. Pronabec ya ha entregado 58.256 becas desde el 2012 para estudios de pregrado. Universidades destacan cualidades de beneficiarios.",https://elcomercio.pe/economia/dia-1/beca-18-numero-plazas-realizar-estudios-universitarios-419056
Pronabec lanza Beca 18 para este año con trámites simplificados,Beca 18 dará mayor puntaje en la evaluación a los postulantes que elijan estudiar en una universidad o instituto de su región,18.04.2017 / 07:45 pm," El Programa Nacional de Becas y Crédito Educativo (Pronabec) del Ministerio de Educación lanzó la convocatoria 2017 de Beca 18, cuyo procedimiento se ha mejorado: el trámite incluye un máximo de cuatro documentos. “Hemos renovado Beca 18, incorporando mejoras que facilitan el proceso de postulación y que nos permitirán llegar a más estudiantes en todo el Perú”, indicó Marushka Chocobar, directora ejecutiva del Programa. Agregó que este año Pronabec quiere hacer énfasis en el soporte integral a los becarios, dado que para muchos de ellos el proceso de adaptación a sus nuevas ciudades o centros educativos podría ser difícil. “Tendremos asesores de bienestar que les brindarán no solo el apoyo académico y administrativo, sino también el emocional y de salud”, informó Chocobar. Según detalló, buscando que los talentos puedan aportar lo aprendido en su comunidad, Beca 18 asignará mayor puntaje en la evaluación a aquellos postulantes que elijan estudiar en una universidad o instituto de su región. Por otro lado, este año habrá dos cortes de fechas. De esta manera, todos los interesados tendrán más posibilidades de inscribirse, incluso los que están en zonas de emergencia. El primer corte de la convocatoria va del 31 de marzo al 30 de abril; y el segundo, del 1 de mayo al 2 de junio. “El objetivo final es que todos los peruanos talentosos tengan la posibilidad de postular a Beca 18 del Pronabec para estudiar en las mejores universidades e institutos del país”, precisó Chocobar. Finalmente, no se tomará el examen único nacional. La única prueba académica que rendirá el postulante será la que tomarán las universidades e institutos que participan en el actual concurso. -Modalidades y beneficios- Beca 18 tiene las siguientes modalidades: Ordinaria, Albergues, Fuerzas Armadas, VRAEM, Huallaga, Repared, Educación Intercultural Bilingüe y Comunidades Nativas Amazónicas. La beca que ofrece el Pronabec tiene una duración de 10 semestres académicos si el becario estudia en una universidad y de seis si lo hace en un instituto. Los promedios del tercer, cuarto y quinto año de secundaria exigidos para postular a Beca 18,  varían desde 12 para postular a un instituto hasta 15 para hacerlo a una universidad, dependiendo de la modalidad a la que postula.",https://elcomercio.pe/peru/pronabec-lanza-beca-18-ano-tramites-simplificados-415347
"San Marcos el suertudo, por Diego Macera","""Los préstamos universitarios tienen como ventaja crear la conciencia sobre el valor de la educación"".",06.04.2017 / 08:00 pm," La Universidad de San Marcos no siempre fue de San Marcos. En la octava y última serie de sus “Tradiciones peruanas”, Ricardo Palma reseña con humor el conflicto de finales del siglo XVI entre quienes disputaban la elección del santo patrono para la entonces Real y Pontificia Universidad de Lima. Mientras que los teólogos apoyaban a Santo Tomás y los abogados a San Bernardo, los médicos argüían que San Cipriano era la opción lógica. El desacuerdo no era menor; de alguna manera estaba en juego nada menos que la esencia de la gran universidad del continente.

Siglos después, la esencia de la Universidad Nacional Mayor de San Marcos (UNMSM) en particular vuelve a entrar en debate. Hace una semana, estudiantes, docentes y trabajadores tomaron el campus universitario en protesta por medidas como el aumento en el cobro del aporte voluntario estudiantil, el pago por el uso de instalaciones deportivas, el encarecimiento del carnet universitario, entre otras, que atentan –dicen los estudiantes– contra la esencia de la gratuidad de la enseñanza en la universidad pública.

Más allá de la condena a las formas violentas e injustificables de protesta, sí hay algo de razón en la queja sanmarquina. Para alumnos pobres, los S/120 de aporte “voluntario” para el laboratorio de ingeniería pueden ser un mundo. ¿Deben entonces los contribuyentes de todo el Perú financiar por completo el laboratorio para los futuros ingenieros sanmarquinos, de manera que estos no paguen nada por él? Aquí la respuesta no es tan fácil.

En primer lugar, es justo reconocer que el retorno social de la educación superior es mucho menor al retorno social de la educación básica o inicial. En otras palabras, si se trata de mejorar la calidad de vida y las capacidades de la población con impuestos, la evidencia sugiere que un sol del presupuesto invertido en programas para la primera infancia como Cuna Más, o en las capacidades de docentes de primaria, tiene más impacto que el mismo sol invertido en la UNMSM. ¿Qué podemos invertir en los dos objetivos al mismo tiempo? Por supuesto, pero todo sale siempre del mismo bolsillo limitado. A diferencia de los universitarios, la nula presión política y mediática que pueden ejercer los pequeños usuarios directos de Cuna Más ayuda a pasar por alto este hecho. Este año, el presupuesto para educación superior fue 12 veces el de Cuna Más.

Si se desea, de todos modos, subsidiar la educación superior, quizá haya dos maneras más eficientes que el sistema actual. Una primera opción es introducir un esquema de escalas progresivas de pago en función a la capacidad económica del alumno y su familia. No hay motivo –moral ni económico– para que un estudiante en capacidad de financiar su propia educación (aunque sea parcialmente) lo haga a costa de los contribuyentes. Más aún, los recursos que se usan en este alumno son recursos que se dejan de utilizar en subsidiar a alguien que sí lo necesita. Los ingresos adicionales recaudados servirían para solventar la educación –y potencialmente la comida o transporte– de los alumnos más pobres.

La segunda opción, quizá complementaria, es multiplicar progresivamente la potencia e institucionalidad de un esquema de becas y préstamos subsidiados como el que tiene a su cargo Pronabec. En vez de financiar a las universidades públicas, el gobierno financiaría a los estudiantes que lo necesiten y merezcan para que estos a su vez elijan el centro de estudios –público o privado, pero siempre acreditado– que prefieran. Los préstamos universitarios tienen además como ventaja alinear los estudios con la demanda laboral (los egresados tienen que conseguir un trabajo para pagar la deuda) y crear la conciencia sobre el valor de la educación: a veces no se valora lo que se consigue gratis.

Cuenta Ricardo Palma que la elección de San Marcos como patrono de la universidad fue fruto del azar: un simple sorteo definió la disputa. En este siglo, quizá vaya siendo tiempo ya de que la suerte y la arbitrariedad sean reemplazadas por el mérito y la necesidad para definir quién paga y quién se beneficia de la esencia de la universidad pública nacional.",https://elcomercio.pe/opinion/columnistas/san-marcos-suertudo-diego-macera-412776
Ofrecen 130 becas para maestrías y doctorados en el extranjero,"El Pronabec abrió inscripciones para la Beca Presidente de la República 2017, que financia el 100% de estudios de posgrado",06.04.2017 / 09:43 am,"El Gobierno dio inicio a la convocatoria para postular a las 130 becas que financian integralmente los estudios de una maestría o doctorado en universidades del extranjero. El plazo final para realizar la inscripción será el 2 de mayo. Follow@EconomiaECpe Para la convocatoria de la Beca Presidente de la República 2017, el Pronabec realizó algunas modificaciones para beneficiar a un mayor número de estudiantes. Se informó que ahora la edad límite para los estudios de maestría y doctorados serán 40 y 50 años, respectivamente. Bases para postular a la Beca Presidente de la República 2017 by Diario El Comercio on Scribd Asimismo, el Pronabec informó que los interesados en la beca podrán cursar estudios de posgrado en universidades que están ubicadas en el ránking de las 400 mejores del mundo. EXIGENCIAS
Según las bases para postular a la mencionada beca, los estudiantes deben ser peruanos residentes y acreditar el grado académico de bachiller o título profesional para cursar una maestría. Para estudiar un doctorado, deberán contar con el grado de maestro. Además, los interesados tienen que conseguir la admisión en una universidad elegible a un programa y demostrar la insuficiencia de recursos económicos para seguir estudios en el extranjero. También se establece como requisito haber pertenecido como mínimo al tercio superior, tener un buen perfil de investigador y no registrar antecedentes policiales, judiciales ni penales. BENEFICIOS
La Beca Presidente de la República cubre el 100% de los gastos académicos de la maestría y doctorado, así como los pasajes aéreos al país donde realizaran los estudios de posgrado, gastos de alojamiento, alimentación, movilidad local y un seguro integral de salud. También se cubrirá los gastos por concepto de trabajo de investigación, así como los trámites administrativos que necesiten para obtener el grado de maestro o doctor. Lee más noticias de Economía...Tweets by EconomiaECpe",https://elcomercio.pe/economia/peru/ofrecen-130-becas-maestrias-doctorados-extranjero-412744
San Marcos: los 142 mejores alumnos se capacitarán en Harvard,"Los jóvenes participarán en un proyecto de fortalecimiento de liderazgo en la parte académica, investigación e innovación.",25.03.2017 / 03:28 pm,"Unos 142 estudiantes de las 65 carreras profesionales de la Universidad Nacional Mayor de San Marcos (UNMSM) participarán en el Programa Profesional y Académico para las Américas de la Fundación Laspau, entidad afiliada a la Universidad de Harvard. Ellos fueron recibidos por el presidente Pedro Pablo Kuczynski en Palacio de Gobierno. El rector de la UNMSM, Orestes Cachay, detalló que los jóvenes participarán en un proyecto de fortalecimiento de liderazgo en la parte académica, en investigación e innovación. ""San Marcos requiere un cambio en la parte científica, en el trabajo en equipo, para que sea como una de las mejores del mundo"", expresó el rector a la agencia Andina. Reveló que dos de los alumnos que viajarán a Estados Unidos pertenecen al programa Beca 18 y son estudiantes en condición de extrema pobreza, por lo que Pronabec evalúa apoyarlos. A ellos, según dijo Cachay, la Universidad de Harvard les está ofreciendo una maestría gratuita. Los estudiantes, que ocupan los primeros y segundos puestos de sus respectivas facultades, viajarán en tres grupos y permanecerán por 15 días en Estados Unidos para participar en talleres vivenciales. Ellos - integrantes del programa Sanmarquinos por el Perú -  están convencidos de que esta oportunidad les cambiará la vida, les hará ver la realidad de manera distinta y los enriquecerá como profesionales. LEE TAMBIÉN Corte Suprema deja al voto pedido de nulidad de fallo que absolvió a Eva Bracamonte https://t.co/ua3OL70aDc pic.twitter.com/RJt32A1fcr— Sociedad El Comercio (@sociedad_ECpe) 25 de marzo de 2017",https://elcomercio.pe/lima/san-marcos-142-mejores-alumnos-capacitaran-harvard-408479
Seis de cada diez becarias del Pronabec son mujeres,"Cinco años atrás solo tres de cada diez becarios eran chicas, en su mayoría de Lima. Hoy el 80% ya son del interior del país.",08.03.2017 / 06:30 pm,"El apoyo educativo para las mujeres con talento pero escasos recursos económicos ha mejorado sustancialmente en los últimos cinco años. Así, de acuerdo a los reportes de Pronabec (Programa Nacional de Becas y Crédito Educativo del Ministerio de Educación), hemos pasado de contar con que solo tres de cada diez becarias sean mujeres en el 2012 a tener ahora seis mujeres por cada diez becados.Follow @EconomiaECpe !function(d,s,id){var js,fjs=d.getElementsByTagName(s)[0],p=/^http:/.test(d.location)?'http':'https';if(!d.getElementById(id)){js=d.createElement(s);js.id=id;js.src=p+'://platform.twitter.com/widgets.js';fjs.parentNode.insertBefore(js,fjs);}}(document, 'script', 'twitter-wjs'); Según Pronabec esto ha sido posible gracias a que se implementaron exámenes de admisión gratuitos y descentralizados en las diferentes instituciones educativas del país, lo que facilitó que las mujeres puedan acudir a postular. En este sentido fue sustancial además montar unas unidades de enlace regional en el 96% de los distritos del país. En ellas se encargaron de contactar a las familias de escasos recursos, quienes por falta de capital priorizaban la educación de los varones, dejando de lado a las chicas. En la actualidad, detallaron, cuentan con 40.209 becadas, de las cuales el 56% están cursando un programa de pregrado, un 24% siguen un postgrado y un 20% otro tipo de estudios. Del total, al menos el 80% son mujeres procedentes del interior del país. SOBRETO TODO NEGOCIANTES De acuerdo al Pronabec, las preferencias de las mujeres en términos de carreras de pregrado elegidas distan mucho del estereotipo femenino. La profesión preferida por las chicas es la administración de negocios internacionales (16%), la cual está seguida de cerca por administración industrial (6%). Ambas especialidades son relativamente nuevas en la oferta académica local. En mucha menor proporción están las carreras ligadas a la computación, ingeniería industrial, administración de turismo y sicología, cada uno con un 3% de porción de la torta. Esto refleja una variación importante en el nivel de preferencias, pues en el 2012 eran justamente las carreras que tenían más tiempo ofreciéndose en el mercado, como computación, las que tenían mayor demanda (17%). INSERCIÓN LABORAL Según informaron, el 77% de las mujeres que han culminado sus becas han logrado colocarse en el mercado laboral. La tasa se eleva a 85% cuando se trata del programa Beca 18, el cual está diseñado específicamente para dar educación superior a jóvenes en situación de extrema pobreza. En el caso del programa que financia alternativas de posgrado como maestrías y doctorados, Beca Presidente de la República, la tasa de colocación en el mercado laboral llega al 78%. El porcentaje de colocación de las egresados, detallaron, se ha ido incrementado en el tiempo de la mano del crecimiento del número de becarias. Y con el objetivo de mejorar aun más dichos indicadores es que el programa ha firmado un acuerdo de colaboración con el portal especializado en búsqueda profesional Bumeran.com. Según detallaron se realizarán acciones conjuntas para insertar al mercado laboral a becarias que pertenecen al tercio superior.",https://elcomercio.pe/economia/negocios/seis-diez-becarias-pronabec-son-mujeres-143606
Joven peruano obtuvo primer puesto en Universidad de Manchester,"Aníbal Tafur Gutiérrez, nacido en Amazonas, se graduó con honores en la Maestría en Ingeniería Estructural",22.01.2017 / 09:58 pm," El estudiante peruano Aníbal Tafur Gutiérrez, nacido en la región Amazonas, ocupó el primer puesto y se graduó con honores en la Maestría en Ingeniería Estructural en la Universidad de Manchester (Reino Unido), uno de los centros de estudios superiores de mayor prestigio en el mundo.  De acuerdo al Programa Nacional de Becas y Crédito Educativo (Pronabec), Tafur también fue nominado al premio “Logro Distinguido”, de la facultad de Ciencias e Ingeniería de la mencionada universidad, y quedó dentro de los ocho finalistas. “Ha sido una gran experiencia enriquecer mis conocimientos en una prestigiosa universidad. Ahora me gustaría trabajar como docente y dedicarme a la investigación, ya sea en mi región o donde me requieran, con tal de contribuir al desarrollo del país"", manifestó. Tafur Gutiérrez, beneficiario de la Beca Presidente de la República del Pronabec, destacó en la Universidad de Manchester por su innovadora propuesta de utilizar aisladores de caucho sísmicos para reforzar las estructuras metálicas de los puentes o similares, a fin de darles una mayor resistencia para soportar los movimientos telúricos de gran magnitud. El joven culminó la carrera de Ingeniería Civil en la Pontificia Universidad Católica del Perú (PUCP) y se desempeñaba como profesor adjunto en su alma mater. Tafur postuló a la Beca Presidente de la República del Pronabec y logró ser uno de los beneficiarios en la convocatoria 2015-1. -Proyecto- Tafur Gutiérrez desarrolló una investigación basada en los daños que sufrió un importante puente de la ciudad de Pisco, Ica, a consecuencia del terremoto que se registró en esa localidad en 2007. El estudiante propuso el reforzamiento del puente usando aisladores sísmicos de caucho, con lo que se lograría que estructuras similares puedan resistir los sismos de similar y mayor magnitud al registrado en la ciudad de Pisco. “Espero que los profesionales aprovechen estas oportunidades que viene dando el Estado a través del Pronabec y que más jóvenes puedan salir del país y luego regresar con el objetivo de plasmar sus conocimientos en nuestro territorio”, manifestó. Tafur Gutiérrez no es el único estudiante peruano que destaca en el extranjero. Marco Carrasco Villanueva ocupó el primer puesto en la Universidad de la Sorbona (Francia) durante sus dos años de estudios en la Maestría de Investigación en Economía y Gestión.  LEE TAMBIÉN",https://elcomercio.pe/lima/joven-peruano-obtuvo-primer-puesto-universidad-manchester-160522
