Titulo,Resumen,Fecha,Contenido,Link
¿Cómo capacitarán en finanzas personales a jóvenes de Beca 18?,"El IEP, Citibank y Pronabec lanzaron la plataforma ""Por mi cuenta"" que busca atender a los más de 40 mil becarios",01.10.2015 / 08:00 am," El Instituto de Estudios Peruanos (IEP), el Citibank y el Pronabec lanzaron la semana pasada la plataforma ""Por mi cuenta"", dirigida a jóvenes beneficiados con la Beca 18. El objetivo es uno solo: permitir que los becarios aprendan de finanzas personales y puedan administrar correctamente el dinero que el Estado les da cada mes. En conversación con El Comercio, Jaime Ramos, investigador y expero en finanzas personales del IEP, dijo que a modo de piloto la plataforma atenderá a 600 jóvenes en lo que queda del 2015. Sigue a Portafolio también en Facebook ""En la segunda etapa que arranca en el 2016 atenderemos a todos los becarios, que son alrededor de 45 mil"", indicó. TEMAS CLAVES Ramos dijo que los jóvenes de Beca 18 requieren esta capacitación porque muchos de ellos no están acostumbrados a realizar un presupuesto mensual o conocen de modalidades de ahorro. ""La capacitación dura cinco semanas y cuenta con igual número de módulos: introducción al sistema económico y financiero, modalidades ahorro, manejo de presupuesto, servicios y productos financieros y canales financieros"", añadió. El enfoque metodológico puesto en práctica es el “edutainment”, una estrategia comunicacional que combina principios pedagógicos y el entretenimiento para garantizar una experiencia de aprendizaje atractiva en el usuario. En ese sentido, se han utilizado historietas, documentos, videos y ejercicios prácticos para cada tema propuesto en los módulos. El especialista precisó que no se descarta que esta plataforma pueda ser abierta al publico en general a partir del 2017.",https://elcomercio.pe/economia/peru/capacitaran-finanzas-personales-jovenes-beca-18-199905
"Beca 18: ""Más del 90% de jóvenes egresados está trabajando""",Pronabec dice que alrededor de 2.000 jóvenes han culminado sus estudios y que incluso hay quienes ganan hasta S/.3000 al mes,30.09.2015 / 01:43 pm," Gracias al programa estatal Beca 18, unos 45 mil jóvenes peruanos cursan estudios en universidades e institutos tecnológicos del país, indicó el Programa Nacional de Becas (Pronabec). En conversación con El Comercio, Raúl Choque, director ejecutivo del Pronabec, dijo que este programa le da una gran oportunidad a jóvenes de escasos recursos económicos que cuentan con alto potencial académico. Sigue a Portafolio también en Facebook ""Estamos atendiendo a chicos de más del 95% de distritos del país, por eso trabajamos con 50 instituciones educativas, entre privadas y públicas, que son las más destacadas"", añadió. El ejecutivo también resaltó que los egresados de Beca 18 tienen una alta empleabilidad. ""Contamos con cerca de 2.000 chicos que han terminado sus estudios, obviamente por el tiempo del programa son los que optaron por carreras técnicas. De ellos, más del 90% están aplicando sus conocimientos profesionalmente"", añadió. Choque sostuvo que los jóvenes de Beca 18 que optaron por instituciones como Tecsup y Senati tienen los sueldos más altos. ""Hay quienes ganan entre S/.3000 y S/.4000, pero eso depende del sector por el que optaron"". CIFRA CONSOLIDADA El director ejecutivo del Pronabec informó que en las próximas semanas se va iniciar el proceso para el otorgamiento de 500 nuevas becas, que permitirán a igual número de jóvenes iniciar clases en el 2016. ""Con esas becas vamos a terminar el período 2012-2016 con 50 mil chicos beneficiados a través del programa Beca 18. Asimismo, para el cierre del 2016 esperamos que 3.000 jóvenes más culminen sus estudios, 2000 de universidades y 1000 más de institutos"", finalizó. ",https://elcomercio.pe/economia/peru/beca-18-90-jovenes-egresados-trabajando-198813
"""Presupuesto 2016 está orientado a una educación de calidad""","El jefe de la PCM, Pedro Cateriano, señaló que el presupuesto al sector educación alcanzará cifra histórica de 3,85% del PBI",02.09.2015 / 05:00 pm," Durante su presentación en el Congreso de la República, el presidente del Consejo de Ministros, Pedro Cateriano, dijo que el presupuesto del año 2016 está orientado fundamentalmente a lograr una educación de calidad. En ese sentido, dijo que el presupuesto para este sector pasará del 3,5% del PBI a un histórico 3,85% del PBI. Cateriano dijo que este incremento está por encima de lo establecido en el Acuerdo Nacional. Sigue a Portafolio también en Facebook “Estos recursos se destinan para continuar con la estrategia de mejora de calidad de la educación”, subrayó el jefe del Gabinete ministerial.   Del presupuesto público 2016, que alcanza los S/.138 490,5 millones, el sector educación representará el 22% del total, añadió. CUATRO PILARES Cateriano dijo que en línea de mejorar la calidad de la educación en el país se trabajará en cuatro pilares: revalorizar la carrera docente, reducir la brecha en infraestructura, mejorar la calidad de los aprendizajes y modernizar la gestión pública. En ese sentido, precisó que para el equipamiento de las instituciones educativas a nivel nacional se destinará S/. 4880 millones y S/.771 para la adquisicion de materiales educativos para la Educación Básica Regular (EBR). También se asignará recursos por S/.903 millones para el otorgamiento de becas a través de la entidad Pronabec, que incluyen 48 mil becas de pregrado (incluye Beca 18), 4000 especiales y 1000 becas de posgrado. Por otro lado, en el 2016 funcionarán ocho nuevos colegio de alto rendimiento (COAR) en el país, que se sumarán a los 14 ya existentes. Los COAR  tendrán un presupuesto asignado de S/.213 millones.",https://elcomercio.pe/economia/peru/presupuesto-2016-orientado-educacion-calidad-197454
Jóvenes del Vraem y su meta: exportar productos de su localidad,"Juan Delgado (18) ayudaba a su familia en una chacra. Como él, otros 69 jóvenes buscan completar estudios superiores en Adex",01.09.2015 / 05:38 pm," Juan Edgar Delgado Flores es un joven de 18 años que trabajaba junto a sus padres y tres hermanas sembrando maíz, trigo y linaza en Huanta, Ayacucho, en la zona de interdicción del Valle de los ríos Apurímac, Ene y Mantaro (Vraem), uno de los sectores más conflictivos de nuestro país debido al narcotráfico y a los remanentes de Sendero Luminoso que aún tienen una fuerte presencia en el lugar. Pero desde mayo pasado su vida ha cambiado radicalmente; ya que, gracias al programa Beca 18, ahora está cursando la carrera de Administración de Negocios Internacionales en el instituto tecnológico de la Asociación de Exportadores (Adex) y tiene como meta formar su propia empresa para exportar los productos de su localidad y, de esa forma, ayudar a su familia. Así como Juan Edgar, otros 69 jóvenes de la zona del Vraem también se encuentran cumpliendo sus sueños de completar sus estudios superiores. Ellos recibieron un reconocimiento por parte del Ministerio de Desarrollo e Inclusión Social (Midis) por el esfuerzo y desempeño que realizan al estudiar tan lejos de casa. Sayda Ruth Camarena Parado, de 16 años, también es parte de ese selecto grupo. Es natural de San Martín de Pangoa, en Junín, y estudia administración de negocios consciente del gran reto que tiene en frente. ""Tenemos que estudiar día y noche para no desaprobar. Me siento orgullosa de mi"", confiesa.  El fuego de la coca en el Vraem. (Video: Ricardo León) Durante la ceremonia participaron Paola Bustamante, titular del Midis; José Villalobos Castillo, director ejecutivo del programa Juntos; Gastón Pacheco, vicepresidente del Adex; Raúl Choque Larrauri, director ejecutivo del Programa Nacional de Becas y Crédito Educativo (Pronabec); el contralmirante Fernando Bolaños del Comando Conjunto de las Fuerzas Armadas y Normal Vidal, viceministra de Prestaciones Sociales del Midis. Choque Larrauri resaltó la importancia de los programas Juntos (Midis) y Beca 18 (Ministerio de Educación), pues ""permite dar la posibilidad a estos jóvenes a que sea profesionales de éxito en beneficio de sus familias, sus comunidades y el país"". Asimismo, la ministra Bustamante explicó que ""los programas sociales se concentran en las personas. Se crean para no salir temporalmente de la pobreza, sino permanentemente"". Dato
Este año, 9.891 jóvenes de familias que participan del programa Juntos lograron alcanzar vacantes para realizar estudios superiores gracias a Beca 18. De ellos, 2.379 obtuvieron cupo para una carrera universitaria, 7.418 en institutos tecnológicos y 164 en institutos pedagógicos.",https://elcomercio.pe/peru/vraem/jovenes-vraem-meta-exportar-productos-localidad-205801
¿Quieres estudiar educación? El Minedu ofrece más de 700 becas,La Beca Vocación Maestro cubre los cinco años de estudios universitarios y todos los gastos para la titulación de los jóvenes,04.08.2015 / 03:57 pm," El Ministerio de Educación (Minedu), a través del Programa Nacional de Becas (PRONABEC), empezó desde el pasado 27 de julio la segunda convocatoria para el concurso de otorgamiento de la beca “Vocación de Maestro” a nivel nacional. Esta vez se ofrecen 742 becas integrales para cursar la carrera de Educación y sus especialidades en nueve universidades elegibles: la PUCP, Cayetano Heredia, UPC, Marcelino Champagnat, UNIFE, USAT (Arequipa), de Piura, Antonio Ruiz de Montoya y Católica San Pablo. Sigue a Portafolio también en Facebook La cobertura de las becas es integral: matricula, ciclo de preparación antes del ingreso a la universidad (dos meses), pensión de estudios durante 10 semestres, idioma inglés asesoría para la tesis y trámites respectivos para la obtención del título. También se incluyen útiles de escritorio, movilidad local, alimentación, alojamiento (cuando corresponda) y seguro médico en la beca.  ¿QUIÉNES ESTÁN APTOS?
Los requisitos para postular son los siguientes: ser peruano, tener 15 de promedio en los últimos tres años de educación secundaria y/o haber ocupado el primer o segundo puesto al terminar sus estudios en un colegio nacional o privado y haber concluido sus estudios entre el 2011, 2012, 2013 y 2014.  Por último, los interesados en las becas debe preincribirse, vía online, con todos los documentos solicitados en www.pronabec.com.pe De acuerdo al cronograma del Pronabec, la preinscripción culmina el 20 de agosto y un día después  estarà disponible la lista de postulantes aptos para rendir el examen de selección, que se realizarà el 30 de agosto.  El 4 de setiembre se sabrá quienes superaron esta prueba y de allí en adelante se validará la documentación presentada por los jóvenes. Finalmente, el 22 de diciembre se tendrá la lista final de los 742 becarios.",https://elcomercio.pe/economia/peru/quieres-estudiar-educacion-minedu-ofrece-700-becas-195682
Sepa cómo acceder a una beca de posgrado en Alemania,Más de 1000 peruanos estudian su maestría o doctorado en Alemania gracias a organismos como el DAAD y Alumni Alemania,01.07.2015 / 08:45 am," Hace cuatro años se instaló en Perú las oficinas del Servicio Alemán de Intercambio Académico (DAAD), una organización que desde el 2013 ha enviado a aproximadamente 150 becarios anuales a Alemania. Hoy más de 1000 peruanos estudian su maestría o doctorado en universidades alemanas. “Una ventaja de estudiar en Alemania es que no es necesario saber alemán, hay muchos programas que son enteramente en inglés” señala el asesor académico de Alumni Alemania, Jorge Aguilar Fuchs, quien agrega que existe una oferta muy alta de diferentes programas de becas y que en total hay más de 17 mil programas en Alemania.   Sigue a Portafolio también en Facebook Aleprona, ALPERU y Alianza Estratégica son algunos de los programas que ofrece el DAAD, en cooperación con entidades y programas como Pronabec. “Estas becas no te exigen un nivel de alemán muy alto, solo el nivel A2, que es el nivel básico”, informa Aguilar. Con una subvención mensual de 850 a 1000 euros, Aleprona cubre el costo de vida del becario ,e incluso le ofrece un curso de alemán de hasta seis meses y subsidio para el cónyuge e hijos del becario, en caso ellos viajen con él. ""Para vivir en Alemania como estudiante se tiene que calcular 700 a 800 euros al mes"", acota. Además Aguilar menciona que “uno de los requisitos de Aleprona es haber pertenecido al tercio superior durante la carrera, el otro es tener experiencia laboral de al menos seis meses"". Dicho programa está dirigido a las carreras de ciencias, ingeniería, educación y economía.  Si se postula al programa ALPERU, el DAAD ofrece una beca parcial y una subvención mensual de 100 euros, igual monto es el que se ofrece en Alianza Estratégica. En ambos programas se entrega al becario 650 euros en forma de crédito educativo, además en ALPERU no se exige al postulante haber pertenecido al Tercio o Quinto Superior. Aunque las áreas más solicitadas son Ingeniería, Educación y Gestión Pública, la oferta no es exclusiva para dichas carreras. El país de Albert Einstein y Ludwig van Beethoven ofrece becas para carreras relacionadas a las ciencias, arte y humanidades.  PROCESO DE SELECCIÓN
“En la mayoría de las becas normalmente se postula con un año de anticipación y se inicia la maestría o doctorado al siguiente, más o menos en el mes de octubre”, dice el asesor de Alumni Alemania , quien invitó a los interesados a postular a los programas que ofrecen. “La postulación para el programa Aleprona será hasta el 15 de septiembre”, dijo.   Lejos de lo que se pudiera pensar, Alemania tiene presencia de becarios de provincias como Arequipa y Cusco. “Nuestras becas están para todos, todos los estudiantes que tengan interés pueden postular, no tenemos ninguna limitación en cuanto al área, es para todos los peruanos”, refiere.  ",https://elcomercio.pe/economia/peru/sepa-acceder-beca-posgrado-alemania-193740
Becas: Conoce la oferta para estudios superiores en el Perú,"Además de Pronabec, instituciones como IPFE, Ankay, Funiber, entre otras otorgan becas de educación superior a los jóvenes",22.06.2015 / 08:19 am," Si es de los que en casa tiene un estudiante a punto de terminar el colegio y su situación económica le ha impedido tomar sus previsiones, por lo que está pensando en postergar el futuro profesional de su hijo/hija hasta que las buenas nuevas regresen a sus bolsillos, deje atrás las preocupaciones y empiece a echar un vistazo a toda la oferta de becas educativas que podría ayudarle a afrontar sin problemas la etapa posterior al colegio de los pequeños del hogar. 1. PRONABEC Y SU ABANICO. Para empezar, el Programa Nacional de Becas y Crédito Educativo (Pronabec) –promovido por el Estado bajo la tutela de Raúl Choque– ofrece un abanico de opciones en lo que a becas se refiere, tanto para pregrado como para posgrado, incluso para universidades del exterior. Sigue a Portafolio también en Facebook Actualmente tiene 15 programas, desde la emblemática Beca 18, pasando por Beca Perú, Beca Deporte Cuba, Beca Presidente de la República, Beca Amistad Perú-Ecuador hasta Beca Alianza del Pacífico, por mencionar algunas.  Para todos los casos, los postulantes deben cumplir –según sea el programa– con los requisitos exigidos por la institución. En el caso de Beca 18, los beneficiarios deben ser menores de 25 años y, casi por regla general, la postulación es en el primer trimestre.
Y, si se trata de una beca de posgrado como la llamada Presidente de la República, la edad variará en caso sea una maestría (menor de 34 años) o un doctorado (menor de 37 años). 2. LAS OPCIONES DEL IPFE
Con una oferta bastante atractiva, en sus más de 50 años el Instituto Peruano de Fomento Educativo (IPFE) ha logrado posicionarse en el mercado. Y en la actualidad ofrece una variada oferta de becas educativas que llegan a cubrir el costo total del programa seleccionado. El financiamiento mínimo es de 10%. A diferencia de otras instituciones, en el IPFE el estudiante que resulte beneficiado debe donar el 5% del valor de la beca otorgada al Fondo Social IPFE. Dicha donación –según explica su director Luis Ducassi–permite que más jóvenes de escasos recursos inicien o culminen sus estudios técnicos. Para pregrado, el IPFE firma convenios con entidades educativas que otorgan becas parciales, los que, junto con los créditos educativos que brinda esta institución, hacen posible el apoyo a los estudiantes que acuden en busca de apoyo. Mientras, para posgrado el IPFE tiene convenios interinstitucionales con Centrum Católica y con las escuelas de posgrado de la USIL y de las universidades Antonio Ruiz de Montoya y Wiener. Además de importantes casas de estudios del exterior y algunas empresas locales. 3. ANKAY, UNA ALTERNATIVA
Aunque con menos años de experiencia, Ankay es una asociación que desde el 2008 ha empezado a identificar a jóvenes talentosos de escasos recursos, a quienes otorga becas integrales para carreras de pregrado  en las mejores universidades privadas del país. Hoy su convenio alcanza a la Católica y la Pacífico. A diferencia de la oferta tradicional, Ankay establece una relación con el becario para acompañarlo tanto durante el proceso de admisión como en el desarrollo de toda la carrera universitaria. ¿De qué manera? A través de monitoreo académico y asesoría psicopedagógica. El costo anual directo de una beca Ankay (paquete básico) es aproximadamente S/.25.000. Aunque el monto final dependerá de la universidad y del número de créditos en el que efectivamente se matricule el becario. 4. FUNIBER, CAROLINA Y MÁS
Debido a que la oferta de becas no se circunscribe solo a instituciones locales, en nuestro día a día también podemos encontrarnos con entidades del exterior que ofrecen diferentes programas para estudiantes peruanos. En el caso de Fundación Universitaria Iberoamericana (Funiber), sus programas son para estudiar tanto a distancia como de manera presencial.  De igual forma, Fundación Carolina ofrece todos los años una interesante propuesta para estudios de posgrado. El número de becas y ayudas ofertadas en su programa de formación para la convocatoria 2015-2016 asciende a 540 y la convocatoria empezará en diciembre. 5. UNIVERSIDADES CON OFERTA PROPIA
Aunque la Universidad Católica tiene la beca R.P. Dintilhac para jóvenes con escasos recursos económicos, como común denominador, gran parte de las universidades privadas en nuestro país cuenta con programas de crédito educativo para estudiantes con problemas económicos. Tal es el caso de la USIL y la Católica. En tanto que la Universidad del Pacífico cuenta con el Fondo UP Solidario. Para todos los casos, el requisito que garantiza la ayuda es el alto rendimiento que debe tener el estudiante.",https://elcomercio.pe/economia/personal/becas-conoce-oferta-estudios-superiores-peru-373148
Jóvenes de Beca 18 que llegaron a Lima no reciben apoyo,Beneficiarios de Beca 18 procedentes de provincias no reciben los S/.1.200 que se les debió otorgar al iniciar clases en Lima,05.06.2015 / 02:00 pm," En un pequeño cuarto en Magdalena vive Joel, de 16 años. Llegó a Lima desde Apurímac el 18 de mayo para estudiar Computación e Informática en la Escuela de Emprendedores de la Universidad San Ignacio de Loyola (USIL). Su familia, en condición de extrema pobreza, vendió sus animales y reunió cerca de S/.1.000 para que él pudiera mantenerse por unas semanas en la capital. Confiaba en que Beca 18 –a través del Programa Nacional de Becas (Pronabec)– le entregaría la manutención de S/.1.200 correspondiente al primer mes. “Solo la habitación me ha costado cerca de S/.600. He tenido que compartirla con un chico para poder pagarla. En estos momentos solo tengo S/.120. Según nos ha dicho nuestro gestor –representante de Pronabec que asesora a los becados en la sede que estudian– el dinero se depositaría el 12 de junio (casi un mes de atraso). No sé si me alcance. Aquí todo es muy caro, empezando por nuestra alimentación”, dice Joel. Al lado de la habitación de Joel, vive Luis. Él ha viajado desde Ayacucho. Su situación es igual de precaria. “Tengo un tío aquí en Lima. Me ha prestado S/.500 para pagar mi habitación, pues mis padres ya no tenían dinero. He llegado a un acuerdo con una señora para que me fíe los almuerzos hasta que me depositen”, explica. Agrega que se siente afortunado, pues sabe de compañeros que están a punto de ser desalojados de sus habitaciones y que comparten almuerzos para poder comer algo en el día. INTERVENCIÓN POLICIAL Katherine Irribarren vive a pocas cuadras de la sede de USIL de Magdalena y suele alquilar habitaciones a estudiantes. Hasta hace unos días vivían en su casa dos chicas provenientes de Tingo María. “Por curiosidad, les pregunté: ¿ustedes qué almuerzan? Es ahí cuando me entero de que tenían dos días sin comer. Y lo que es más grave, me cuentan que muchos de sus compañeros están en una situación parecida o peor. Estas chicas acuden ahora al local de USIL en Independencia. No sé qué será de ellas”. Actualmente, Irribarren vive con Berta, una menor de 17 años proveniente de Ayacucho. “No tenía muy claro cómo iba a ser Lima. La información que nos dio Beca 18 en nuestros pueblos fue distinta. No sabía que la habitación ni la comida iban a ser tan caras. Tampoco sabía del clima. No sé cómo movilizarme”, cuenta Berta. “Al enterarme de la precariedad de estos chicos me acerqué a conversar con autoridades de USIL. Su respuesta sobre la posibilidad de ayudarlos fue negativa. Ellos solo se encargan de ver por sus estudios”, cuenta Geraldine Moreno, amiga de Irribarren. Afirma que tras esto fue a pedir ayuda a la Municipalidad de Magdalena. Ahí le dijeron que mandarían oficios al Ministerio de la Mujer y Poblaciones Vulnerables (Mimp) para que se enteren de la situación, pero que tampoco podía hacer más. Una vez en el Mimp, este le comunicó que la situación tampoco era de su competencia. 
“Después nos logramos comunicar con el director ejecutivo del Pronabec, Raúl Choque. Sin embargo, él lo negó todo y afirmó que todo estaba bien con los becarios”, dice Moreno. AYUDA DE EMERGENCIA En entrevista con El Comercio, Raúl Choque, director ejecutivo de Pronabec, afirmó que las demoras en la entrega de las cuotas mensuales se deben principalmente a trámites para acceder al sistema bancario. También explicó que Pronabec no puede entregar el dinero antes, pues, busca evitar el riesgo de que los becarios abandonen el programa antes de empezarlo. Sobre la precaria situación de algunos de sus becarios informó que “para ellos existe un fondo de emergencia”. Acerca de la desinformación de algunos de ellos, aceptó que sus oficinas regionales están fallando en comunicar la realidad limeña. Agregó que Pronabec evalúa permanentemente a sus colaboradores. Si ellos no cumplen con sus funciones a cabalidad son evaluados y, si lo amerita, son separados. Indicó que hoy se les depositará la subvención a gran parte de los 680 becarios. ",https://elcomercio.pe/lima/jovenes-beca-18-llegaron-lima-reciben-apoyo-370413
Minedu otorgará 500 becas universitarias para hijos de maestros,El ministro Saavedra indicó que la convocatoria se realizará en el segundo semestre de este año y clases empezarán el 2016,01.06.2015 / 04:17 pm," El titular del sector Educación, Jaime Saavedra, anunció que el 2016 el Ministerio de Educación (Minedu) pondrá en marcha una beca especial para los hijos de profesores que hayan logrado un alto rendimiento académico. La intención es que los jóvenes, hijo de maestros de la educación básica regular,  puedan acceder a las mejores universidades del país, como una forma de continuar con la estrategia de reconocimiento y revalorización de la profesión docente. Jaime Saavedra dijo que serán 500 becas cuya convocatoria se realizará en el segundo semestre de este año, las mismas que tendrán similares estándares de calidad y exigencia que propone el Programa Nacional de Becas y Crédito Educativo (PRONABEC). BECAS EN EL 2015 Ese año el Minedu cuenta con un presupuesto de más de S/.850 millones de soles para la otorgación de becas educativas de nivel superior.  En total, se prevé otorgar 45 mil becas hasta fin de año, que contemplan las distintas modalidades: Beca 18, Beca Presidente de la República, Beca de Excelencia Académica, entre otras.",https://elcomercio.pe/economia/peru/minedu-otorgara-500-becas-universitarias-hijos-maestros-191831
