Titulo,Resumen,Fecha,Contenido,Link
Marilú Martens evalúa denunciar al medio que la acusó de hacer postular a su hijo a beca del Estado,"La titular de Educación indicó que el diario Exitosa, que publicó la información, nunca le pidió mi versión respecto al tema.",31/07/2017 14:42h," Tras brindar su versión respecto a la denuncia que realizó el diario Exitosa hoy, la ministra de Educación, Marilú Martens señaló que evalúa denunciar al medio de comunicación. ► Hijo de Ministra de Educación calificó como ""una mentira y difamación"" denuncia sobre beca del Estado En comunicación con RPP, la ministra sostuvo que ""lamentablemente esta noticia me ha sorprendido esta mañana, porque nunca me pidieron mi versión, nos ha indignado a mi y a mi familia"". Asimismo, Martens indicó que la denuncia ha sido malintencionada por lo cual se encuentra evaluando las medidas que se van a tomar y no descarta demandar al medio. La titular de Educación comentó que la iniciativa de postular a la beca fue de su hijo y que ni ella ni su esposo se iban involucrar en el pago de los estudios de posgrado porque su compromiso como padres culminó cuando su hijo terminó sus estudios superiores. ""Lo que debe quedar claro es que mi hijo es un joven transparente y no ha ocultado nada, él ha puesto los ingresos de la familia y ha llenado con transparencia los datos"", declaró Martens. La ministra también indicó que él era independiente y tenía sus ingresos, ante ello se le cuestionó el por qué pusó en el formulario que no tenía ingresos, Martens respondió que no tiene claro el por qué no los consignó.",https://peru21.pe/lima/marilu-martens-evalua-denunciar-medio-acuso-postular-hijo-beca-91891
Congresistas piden renuncia de la ministra Marilú Martens,"Parlamentarios consideran que, aunque no se le otorgó la beca, “basta con la intención”.",31/07/2017 13:45h," Ante la denuncia de que el hijo de la ministra de Educación, Marilú Martens postuló a la Beca Presidente en el Programa Nacional de Becas (Pronabec), congresistas de diversas bancadas se han pronunciado solicitando la renuncia de la funcionaria. El tercer vicepresidente del Congreso, Mauricio Mulder, señaló que, aunque no procedió la solicitud, ""la intención es lo que cuenta"". ""En el derecho penal basta la intención. De modo que aquí creo que se tiene que establecer responsabilidades y eso pasa por la renuncia de ministra ( Marilú Martens)"", manifestó el aprista. Una opinión similar fue dada por la congresista Alejandra Aramayo (FP) quien refirió que ""la ministra de Educación debe renunciar tras denuncia que señala que habría intentado beneficiar a su hijo con una beca del Estado en 2014"". Por su parte, el legislador Yonhy Lescano (AP) también consideró que si la ministra Marilú Martens debería dar un paso al costado ""o tendría que ser interpelada en el Congreso"". Para los legisladores, Martens debe dar explicaciones por pedir la beca para su hijo, aunque queda claro que lo hizo su hijo, y que la denuncia hecha por un medio local ha sido desmentida categóricamente por un medio local. Según indicó la titular de Educación, su hijo, Gabriel Aguirre Martens, postuló a varios programas públicos y privados de forma independiente y cuando tenía 26 años, y señaló que ""no se violó ni se cometió ninguna falta ética. Tampoco hubo favoritismos o presiones, es por eso que se le niega la beca"".",https://peru21.pe/politica/congresistas-piden-renuncia-ministra-marilu-martens-91887
Ministerio de Educación confundió a Don José de San Martín con Simón Bolívar,"El discurso de independencia fue dicho por el héroe venezolano, según una publicación que ya fue borrada.",25/07/2017 09:35h," En la historia del Perú hay letras sagradas. El himno nacional, la Constitución, los poemas de César Vallejo, lo dicho por Francisco Bolognesi y hasta las composiciones de Chabuca Granda podrían entrar a este selecto grupo. Pero sin duda, las palabras de José de San Martín al proclamar la independencia del Perú en 1821 serían una de las infaltables. Sí, lo que dijo el libertador argentino resuena en la mente de la mayoría de peruanos, ¿pero qué sucede cuando el Ministerio de Educación confunde al libertador? ► ¿Cómo unos becarios peruanos de posgrado le ganaron la batalla al Pronabec? Esa es la pregunta que se hicieron miles de internautas este lunes al ver una publicación de Perú Educa, una comunidad del Minedu que brinda herramientas a docentes y alumnos. Como parte de sus publicaciones por el mes patrio, el fanpage decidió colocar lo dicho por San Martín aquel 28 de julio de 1821. ""Desde este momento, el Perú es libre e independiente, por la voluntad general de sus pueblos y por la causa que Dios defiende"", manifestaba la imagen. Pero el error, increíblemente, estuvo en la foto que acompañaba la frase. En ella aparecía Simón Bolívar, figura venezolana que participó en la reorganización del Perú independiente. José de San Martín nunca aparece. Ante la avalancha de comentarios por el error, Perú Educa borró la publicación y posteriormente hizo una errata, la cual fue compartida por la propia página del Ministerio de Educación.",https://peru21.pe/lima/ministerio-educacion-confundio-don-jose-san-martin-simon-bolivar-90324
¿Cómo unos becarios peruanos de posgrado le ganaron la batalla al Pronabec?,Cerca de 80 personas fueron descartadas para lograr la ‘Beca Presidente de la República’ solo por poner un pie fuera del país. Ellos alzaron su voz de protesta. Sepa más de este caso.,23/07/2017 08:06h," Entre las distintas becas que ofrece el Programa Nacional de Becas y Crédito Educativo (Pronabec) existe una que es la denominada 'Beca Presidente de la República', la cual va dirigida a aquellas personas que pretenden realizar una maestría o doctorado en una universidad prestigiosa en el extranjero. Esta es una excelente oportunidad para quienes no tienen la posibilidad de costear los gastos que implica este tipo de estudios superiores. Sin embargo, dentro de los requisitos que se especificaba para acceder a esta beca, existía uno que puso en el ojo de la tormenta a este atractivo programa educativo. ➤ ¿Por qué este requisito para postular a una beca posgrado del Pronabec causa tanta polémica ? Tal y como Perú21 lo detalló en una nota anterior, la 'Beca Presidente de la República' solicitaba a sus postulantes a no abandonar nuestro país, al menos, no un año antes de las convocatorias que Pronabec lanza a lo largo del año. En este requerimiento existía un vacío y una ambigüedad que provocó que alrededor de 80 aspirantes se quedaran con sus sueños truncos y no consigan seguir sus especialidades en Harvard, Oxford, Manchester o en cualquier otro centro de estudios. Si bien es cierto que actualmente este proyecto del Ministerio de Educación ya flexibilizó el punto que anteriormente era señalado como cuestionable, el cambio se dio gracias a un grupo de becarios peruanos que fue descartado del proceso y que no se quedó con los brazos cruzados ante esta ""injusticia"" como la llama Orlando Román, uno de los afectados por el impasse. Orlando Román contó a Perú21 que en la primera convocatoria de la 'Beca Presidente de la República' 2017-I postularon un total de 566 personas y que, de ellas, 80 personas se quedaron en el camino por haber viajado al extranjero. ""Todos nosotros fuimos declarados aptos y por eso pasamos a entrevista personal de acuerdo a nuestro puntaje de documentación y entrevista"", manifestó a este diario. No obstante, indicó que hubo otro grupo de 33 aspirantes que fueron declarados como 'no elegibles' en la segunda etapa solo ""por haber viajado y no por haber no haber alcanzado el puntaje"". En esta misma fase, hubo otro grupo de 58 postulantes 'no elegibles' por no alcanzar vacante y por estar en lista de espera. Del puñado, 40 fueron eliminados por otras causales pero los 18 restantes quedaron fuera por haber viajado al extranjero. Es en la tercera y última fase de la convocatoria en que 130 becarios llegaron a clasificar pero hubo un filtro más. 44 no pudieron alcanzar la beca mientras que los 86 restantes sí fueron indicados como 'virtuales becarios'. ¿Cuál fue la razón? Como era predecible, 29 de los 44 descartados fueron eliminados porque habían pisado suelo extranjero. ""Es importante resaltar que los 80 fuimos eliminados solo por el viaje. Si no hubiéramos entrado al concurso y muchos habríamos entrado en los 130 cupos"", declaró Orlando Román a Perú21. Pero, ¿acaso estos postulantes fueron eliminados por ir en contra del requerimiento? Para Román, ""no tiene sentido"" que los hayan eliminado por las siguientes razones que especificó y recopiló de sus amigos: Estos casos fueron llevados hasta a la Defensoría del Pueblo para que esta instancia pública abogara por los afectados y exigiera al Pronabec que retirara o cambiara este cuestionado requerimiento. La respuesta vino un mes después y lo sucedido con los becarios descartados fue clasificada como ""irrazonable"" por el ente defensor. ➤ Esta es la respuesta sobre las becas de posgrado del Pronabec que estábamos esperando Perú21 tuvo acceso al documento que fue enviado a Marushka Victoria Chocobar Reyes, directora ejecutiva del Pronabec. El Oficio N°134 tiene fecha del 19 de julio y como conclusión se obtuvo que ""no se excluya de manera irrazonable a postulantes que cumplen con el requisito de tener su domicilio (residencia habitual) en el Perú"". Pero como este grupo de futuros becarios querían alguna solución inmediata, siguieron alzando la voz de protesta e hicieron llegar esta queja hasta el Congreso de la República. El reclamo fue enviado hacia la parlamentaria del Frente Amplio, Marisa Glave, quien se reunió con ellos para abordar su caso y con Chocobar Reyes. La misiva emitida hacia la legisladora data del 18 de julio último y, un día después, Glave publicó en su página de Facebook un par de fotos en la cuales se le observa en compañía de unos de los postulantes afectados. De acuerdo con lo que describió la congresista, ""el Comité Evaluador de dicha institución (Pronabec) realizó una supuesta interpretación literal e irracional del requerimiento, pues muchos de ellos salieron del país por asistir a congresos"". Además, un día después de esta cita con los aspirantes truncados a la 'Beca Presidente de la República', la parlamentaria siguió insistiendo en que este polémico requerimiento tenga una solución. ""Este gobierno de 'lujo' ¿podría tomarse la molestia de tener funcionarios que tengan un razonamiento superior al de un robot? Hay jóvenes a los que se les ha excluido porque fueron a dar un examen fuera del Perú, ¡saliendo menos de 48 horas!"", publicó indignada Marisa Glave. Luego de la reunión con Marisa Glave y del pronunciamiento de la Defensoría del Pueblo, el Pronabec dio el brazo a torcer y accedió a los cambios en las bases de los requerimientos para esta beca de posgrado en el extranjero. Como se pudo consignar, Perú21 conversó con Fernando Cáceres, viceministro de Gestión Institucional del Ministerio de Educación (Minedu), y este declaró que habían ""procedido a modificar el requisito de permanencia en territorio nacional a un periodo de seis meses bajo residencia habitual"". Si bien es cierto que esta variación en las solicitudes fue bien vista por los afectados, Orlando Román refirió que el cambio se debió hacer antes y no esperar hasta estas alturas del caso cuando varios becarios están a pocos días de empezar sus clases. ""Esta segunda convocatoria si tiene estas mejoras por las que se ha luchado y ya no permite que un funcionario robótico interprete sin criterio alguno"", añade Orlando. ""¿Salir del país por un día o una semana hace que residas fuera? ¿El hecho de que hayas ido a un congreso internacional o a dar un examen fuera, hace que no vivas en el Perú? En esta segunda convocatoria sí se está pidiendo residencia (en el Perú), como debió haber sido en la primera. Lo más importante es que ahora sí se está aplicando el concepto de residencia y no el concepto de que por poner un pie fuera de la frontera, te eliminan del concurso"", apuntó a este diario. Es decir, si en la primera convocatoria se especificó que uno de los requisitos era que los postulantes fueses residentes peruanos, ¿por qué tacharon a los 80 aspirantes si cumplían con esta solicitud? ¿Solo por haber viajado al extranjero por casos excepcionales? ""Sentimos que nos dieron la razón, todos hablan de que este requisito se trataba de residencia y nosotros somos residentes peruanos. Sin embargo no sabemos por qué Pronabec no pudo subsanar el error en el primer proceso mismo y tuvo que sacar una convocatoria extra, perjudicando a mucha gente. El problema ha sido la errónea interpretación del articulo en la primera convocatoria y eso no ha sido subsanado"", sentenció Orlando. El grupo de 80 postulantes perjudicados siguen a la espera que alguna entidad pueda solucionar este problema que les han ocasionado.",https://peru21.pe/lima/becarios-peruanos-posgrado-le-ganaron-batalla-pronabec-89855
¿Te atemorizan estas imágenes? Puedes estar padeciendo 'tripofobia' [FOTOS],"Esta extraña repulsión por esos patrones de hoyos o figuras geométricas, tiene nombre y ha sido estudiado por investigadores ingleses.",22/07/2017 17:33h," La 'tripofobia' es el nombre que lleva el miedo o repulsión generados al mirar o estar cerca de figuras geométricas muy juntas, en especial hoyos y rectángulos muy pequeños. Pese a que la 'tripofobia' no es reconocida como fobia por la comunidad de psicólogos, investigadoras de la Universidad de Essex (Inglaterra) la analizaron en un estudio sobre el miedo a los hoyos. Según informa BBC . ► Esta es la respuesta sobre las becas de posgrado del Pronabec que estábamos esperando En las investigaciones, del grupo de 286 personas que examinaron, el 16% reaccionó con repulsión a imágenes que muestran ese patrón geométrico, como la de la flor de loto, o los panales de abejas. En el estudio, realizado en 2013 bajo el título: 'El miedo a los hoyos', los investigadores determinaron que cuando alguien con 'tripofobia' mira las imágenes que le producen repulsión, se le acelera el ritmo del corazón, y se pronuncia la actividad en la parte del cerebro que procesa la visión. Incluso, uno de los pacientes manifestó que el ver las imágenes de huecos pequeños en grupos asimétricos o irregulares le hacía ""vomitar en la boca, llorar un poco y temblar profundamente por todo el cuerpo"". La también llamada 'fobia al patrón repetitivo', se conoció a partir del 2009, cuando un estudiante de Nueva York decidió abrir una página en Facebook en donde publicaba fotos que le causaban un extraño temor y angustia. ► Google le rinde homenaje a Marshall McLuhan, el ""profeta de Internet"" A partir de ese momento, empezaron a aparecer diversas personas que aseguraban tener los mismos síntomas, y el interés se disparó. Aparecieron foros en Reddit e Instagram, hecho que llevó a los expertos a tratar de entenderla y generar posibles teorías. Sin embargo, existen expertos que consideran que se puede tratar de un fenómeno viral propio de las redes sociales y los medios. Según los investigadores Arnold Wilkins y Geoff Cole, de la Universidad de Essex, esta repulsión a este tipo de patrones y formas puede deberse a un 'mecanismo de defensa' que cargamos con nosotros. ► Exhumaron los restos de Salvador Dalí a pedido de una vidente Esto debido a que muchos de los animales silvestres potencialmente letales y venenosos como algunas arañas, serpientes, ranas o pulpos, tienen marcas similares. Los investigadores concluyeron que una presión selectiva para que los humanos evitaran estos patrones en plantas y animales evolucionó en la denominada 'tripofobia'.",https://peru21.pe/lima/atemorizan-imagenes-puedes-padeciendo-tripofobia-fotos-89777
Recomendación del editor: Estas son las cinco noticias que debes leer a esta hora,Estas son las notas más importantes del momento para que continúes bien informado.,21/07/2017 19:57h, En esta nota te presentamos las noticias más importantes de esta hora de la noche para que sigas bien informado. ► ¡Se dispara! El kilo de limón se encuentra por encima de los S/5 en Lima ► La feria gastronómica Mistura se muda al Rímac ► VRAEM: Cuatro policías heridos tras ataque de narcoterroristas ► Esta es la respuesta sobre las becas de posgrado del Pronabec que estábamos esperando ► Elon Musk: Conoce al visionario hombre detrás del revolucionario tren 'Hyperloop' y de 'Tesla Motors',https://peru21.pe/lima/recomendacion-editor-son-cinco-noticias-debes-leer-hora-1-89641
Esta es la respuesta sobre las becas de posgrado del Pronabec que estábamos esperando,Usuarios de Facebook cuestionaron el requisito que solicitaba haber estado en tierras nacionales un año antes de postular a la beca.,21/07/2017 18:12h," Un requisito para acceder a la 'Beca Presidente de la República' del Pronabec ha generado polémica entre los postulantes y ha sido trasladada a las redes sociales. ¿La razón? Uno de los requisitos para acceder a este beneficio sostenía que cualquier postulante debe residir en el país, como mínimo, un año antes de la fecha de la convocatoria. ➤ ¿Por qué este requisito para postular a una beca posgrado del Pronabec causa tanta polémica? El primer concurso para becas se realizó en marzo de este año y la segunda convocatoria inició ayer. En Facebook, varios han calificado este requisito como un 'sin sentido'. Perú21 se contactó con Fernando Cáceres, viceministro de Gestión Institucional del Ministerio de Educación (Minedu), quien señaló que a raíz de diversos comentarios se ha procedido a modificar los requisitos de este inciso, pero que su finalidad continúa siendo la misma. ""Hemos procedido a modificar el requisito de permanencia en territorio nacional a un periodo de seis meses"", indicó el funcionario del pliego de Educación. De esta manera, refirió que los postulante podrán acudir a congresos y viajar a entregar documentos siempre que se compruebe la residencia habitual de los mismos. Explicó a este diario que la razón por la que inicialmente se incluyó este requisito era porque había peruanos que no residían en el país y que solo regresaban a territorio nacional para acceder a este beneficio. Sin embargo, una vez culminado el posgrado, estas personas continuaban en el extranjero y no regresaban al Perú. ""Con esta precisión se busca que el beneficiado tenga el compromiso de regresar al país y contribuya con todo lo que ha aprendido luego de asistir al posgrado"", refirió Cáceres. Respecto a las especulaciones sobre si este requisito se impuso para evitar que personas con suficiencia económica pudieran acceder a la 'Beca Presidente de la República', el viceministro de Gestión Institucional del Minedu aclaró que el Pronabec cuenta con diferentes tipos de becas, cada una dirigida a un sector específico, por lo que personas de nivel socioeconómico medio o alto pueden postular a otras convocatorias. ➤ Esto es todo lo que debes saber sobre el balance de la gestión de PPK ""Otorgamos becas según los requisitos. En Pronabec tenemos cuatro tipos de becas: De inclusión social, para poblaciones vulnerables, de desarrollo humano y de alto rendimiento"", sostuvo. El representante del Minedu señaló que se ha procedido a informar a aquellos postulantes que no pudieron acceder a la beca por el motivo de tiempo en el país para que puedan nuevamente acercarse en esta segunda convocatoria. Refirió que en total son 29 afectados, cuyos expedientes podrán ser utilizados sin necesidad de realizar otros trámites.",https://peru21.pe/lima/respuesta-becas-posgrado-pronabec-estabamos-esperando-89601
¿Por qué este requisito para postular a una beca posgrado del Pronabec causa tanta polémica?,Uno de los requerimientos para acceder a este beneficio ha sido calificado por algunos usuarios como un ‘sin sentido’. Conoce más en esta nota.,21/07/2017 15:28h," El Programa Nacional de Becas y Crédito Educativo ( Pronabec ) del Ministerio de Educación es uno de los proyectos más atractivos de esta cartera. De hecho, varios estudiantes peruanos han alcanzado sus sueños gracias a este beneficio que ofrece el Estado. Un claro ejemplo es Tafur Gutiérrez, un joven peruano que alcanzó el primer puesto en una maestría en Ingeniería Industrial de la Universidad de Manchester. Sin embargo, existe un requerimiento que ha sido cuestionado por los aspirantes a acceder a una beca para estudios de posgrado. ► Ingeniero peruano ocupó primer puesto en maestría cursada en Universidad de Manchester ¿De qué se trata? Dentro de los requisitos para poder acceder a la 'Beca presidente de la República' se detalla que cualquier postulante debe residir en el país, como mínimo, un año antes de la fecha de la convocatoria. Esto es lo que dice el quinto punto específicamente: ""Tener domicilio y encontrarse físicamente en el Perú, como mínimo un año previo a la postulación y durante todo el proceso de la convocatoria hasta la adjudicación de la beca, en el caso de los ciudadanos que han retornado al país y se han acogido a la Ley Nº 30001, adicionalmente deberán presentar su Tarjeta del Migrante Retornado"". La exigencia señalada fue calificada como un 'sin sentido' por parte de algunos usuarios sociales. ""Sin sentido! O sea si te fuiste a un congreso internacional en el último año o a presentar un papel no puedes aplicar? ¡Sin sentido!"", escribió una usuaria en Facebook. ""Es como si las reglas las hubiera puesto justo la persona que menos sabe lo que implica hacer una maestría e investigar"", dice otra persona. Es decir, algunas personas se quejan de que por alguna fortuita eventualidad uno tenga que salir obligatoriamente del país en uno de los 365 días anteriores a la postulación o, alguien tenga que viajar dentro del proceso de la beca, perdería este beneficio automáticamente. ¿Es justo?",https://peru21.pe/cheka/redes-sociales/requisito-postular-beca-posgrado-pronabec-causa-polemica-89561
Beca 18: Se amplía la fecha de postulación del programa hasta el 7 de junio,En la actualidad existe un total de cuatro mil vacantes para jóvenes de diferentes regiones del país con buenas calificaciones.,05/06/2017 15:33h,"Hay más tiempo para postular a la convocatoria de Beca 18 , el Programa Nacional de Becas y Crédito Educativo (Pronabec) del Ministerio de Educación. ¿La razón? La gran demanda de los postulantes. Ahora los jóvenes talentosos tienen más tiempo para aplicar, precisamente hasta el 7 de junio. En la actualidad existe un total de cuatro mil vacantes para jóvenes de diferentes regiones del país con buenas calificaciones y de escasos recursos económicos. Todos pueden optar por institutos o universidades de prestigio. Los promedios del tercer, cuarto y quinto año de secundaria que se exigen para concursar en esta beca varían desde nota 12 para postular a un instituto hasta 15 para hacerlo en una universidad. Estas son las modalidades: Ordinaria, Albergues, Fuerzas Armadas, VRAEM, Huallaga, Repared, Educación Intercultural Bilingüe y Comunidades Nativas Amazónicas. El programa también otorga una subvención para alimentos, movilidad y transporte local, así como para gastos de alojamiento. La inscripción puede ser online . Un día como hoy PPK fue elegido presidente del Perú https://t.co/3yTrY8eExN pic.twitter.com/sW8LhvGmMw — Diario Perú21 (@peru21noticias) 5 de junio de 2017",https://peru21.pe/lima/beca-18-amplia-fecha-postulacion-programa-7-junio-79146
