Titulo,Resumen,Fecha,Contenido,Link
Lo que debes saber para acceder a las 130 becas para maestría y doctorado en las 400 mejores universidades del mundo,"Hasta el miércoles 10 de este mes, los interesados en postular a la ‘Beca Presidente de la República’ podrán inscribirse para tentar alguna de las 130 plazas que se ofrecen.",03/05/2017 13:18h," Hasta el miércoles 10 de este mes, los interesados en postular a la Beca Presidente de la República podrán inscribirse para tentar alguna de las 130 plazas que se ofrecen. El Programa Nacional de Becas y Crédito Educativo (Pronabec) del Ministerio de Educación informó que la prórroga permitirá que graduados y profesionales del país puedan inscribirse y concursar para lograr un cupo. Los ganadores podrán realizar estudios de maestría o doctorado en universidades ubicadas entre las 400 primeras del mundo. -Lo nuevo de esta última convocatoria de Beca Presidente de la República de Pronabec es la reducción del tiempo de experiencia laboral requerida para realizar estudios de maestría o doctorado. -Según las bases del concurso, los postulantes que quieran estudiar una maestría ahora solo deberán acreditar un año de experiencia laboral desde la obtención del grado de bachiller. -Quines opten por el doctorado deberán registrar dos años de experiencia desde la obtención del título profesional. Anteriormente, el periodo de trabajo requerido era de dos y cuatro años respectivamente. -Otra de las innovaciones se refiere a la edad máxima requerida para postular. Para las maestrías la edad máxima es de 40 años y para el doctorado de 50 años cumplidos al 31 de diciembre de 2017. -En ambos casos se debe acreditar la carencia de recursos económicos necesarios para realizar estudios de posgrado en el extranjero. -Todos los profesionales que quieran postular a Beca Presidente de la República deben ser peruanos y residentes en el país, contar con una carta de admisión de una de las universidades elegibles donde realizarán sus estudios de posgrado y acreditar haber formado parte del tercio superior durante sus estudios de pregrado o posgrado respectivamente. -Esta beca cubre los gastos académicos, administrativos y de investigación, así como de alojamiento, alimentación y de traslado de postulantes a la capital (Lima). -También cubre los pasajes aéreos para viajar al país donde se realizarán los estudios y un seguro integral de salud. De necesitar mayor información se puede visitar la página web , llamar al 6128230 (anexo 274), a la línea gratuita 0800-00018 o escribir a beca.presidente1@pronabec.gob.pe.",https://peru21.pe/lima/debes-acceder-130-becas-maestria-doctorado-400-mejores-universidades-mundo-74969
Ministro de Trabajo no descarta un aumento del sueldo mínimo antes de diciembre,Alfonso Grados señaló que el Consejo Nacional del Trabajo presentará una propuesta para fijar un nuevo monto en la Remuneración Mínima Vital este año.,01/05/2017 14:51h," El ministro de Trabajo, Alfonso Grados , declaró que no descarta que se presente una propuesta para aumentar el sueldo mínimo, como parte de las medidas que evalúa la comisión técnica del Consejo Nacional del Trabajo. ""Yo no he descartado que haya un aumento de la Remuneración Mínima Vital ( RMV ), lo que yo he mencionado es que para que se pueda dar un incremento de la RMV en el momento que corresponda, se tienen que evaluar una serie de aspectos. Básicamente, el incremento del costo de vida, el crecimiento de la economía del país, para ver de dónde van a salir los recursos y la productividad laboral"", remarcó. Grados agregó que el aumento de la RMV se debe estudiar a fondo ya que es un tema en el que está comprometida la informalidad del país, que es uno de los mayores problemas de la economía nacional. ""La problemática de la RMV lo tenemos que estudiar a fondo, por eso la reforma que queremos trabajar es una reforma pro empleo, para generar más productividad para que tengan mayor empleo"", agregó. El ministro dijo que comenzarán el análisis técnico en el segundo semestre de este año y que deberían tener una propuesta ""ojalá hacia fines del tercer trimestre en adelante"". También sostuvo que el Gobierno busca que este emprendimiento se nutra de los procesos de socialización y debate que se generan en el seno del Consejo Nacional del Trabajo y Promoción del Empleo y en los diversos foros de análisis técnico, social y político que se promueven desde su sector. El ministro destacó que están trabajando incansablemente, a pesar de las dificultades y voces contrarias, en pro de la modernidad productiva del marco laboral peruano, para lo cual se debe empezar combatiendo la informalidad, principal causa de empleos precarios.",https://peru21.pe/lima/ministro-descarta-aumento-sueldo-minimo-diciembre-74702
Aspirantes a beca 'Mi Vocación Técnica' del Pronabec podrán inscribirse hasta el 17 de mayo,"La primera convocatoria aplica para las regiones de La Libertad, Lima y Piura",01/05/2017 12:12h,"El Programa Nacional de Becas y Crédito Educativo ( Pronabec ), informó que el plazo de inscripción para todos los interesados en postular a la beca Mi Vocación Técnica se ha ampliado hasta el 17 de mayo. De esta forma, los estudiantes del cuarto año de secundaria de La Libertad, Lima y Piura podrán concursar por las mil becas integrales de esta convocatoria, donde se ha lanzado el programa de manera piloto. El estudiante debe contar con un promedio mínimo de 12 en los tres primeros años de secundaria y un máximo de 18 años de edad, cumplidos hasta el 31 de diciembre del 2016. Las inscripciones se realizan en el siguiente enlace . Beca Mi Vocación Técnica propone una amplia cobertura de beneficios para incentivar a los alumnos a terminar su secundaria: costo de la matrícula, pensión y materiales de estudios, uniforme y certificado modular, además de gastos de alimentación y movilidad local. Las clases se desarrollarán los sábados entre las 8 am y las 4 pm durante el periodo escolar. En vacaciones, el horario será el mismo, pero de lunes a viernes. Cabe señalar que durante los 20 meses que dure la capacitación, los jóvenes recibirán 950 horas académicas, en 151 instituciones seleccionadas por el Ministerio de Educación. Los estudiantes podrán convalidar sus estudios en institutos de educación superior tecnológica para obtener su grado de técnico. El #DíadelTrabajo también es una oportunidad para protestar contra Nicolás Maduro en Venezuela https://t.co/swtLwxMqVE pic.twitter.com/teV7L9JqfW — Diario Perú21 (@peru21noticias) May 1, 2017",https://peru21.pe/lima/aspirantes-beca-mi-vocacion-tecnica-pronabec-podran-inscribirse-17-mayo-74682
Ministra de Educación invita a estudiantes de Iquitos a postular al Programa Beca 18,"Marilú Martens se encuentra con el presidente en Iquitos, donde conversó con las autoridades sobre los diversos problemas en el lugar.",28/04/2017 17:54h,"La ministra de Educación, Marilu Martens, llegó a Iquitos en la comitiva presidencial y se reunió con alcaldes de Madre de Dios, Iquitos y Ucayali, a quienes reiteró su compromiso de mejorar la calidad educativa en la selva. Martens aseguró que están en plena instalación de aulas prefabricadas e implementación de aulas alternativas en las zonas de emergencia como Piura. Esto se podría replicar en diversos puntos de la región, donde los estudiantes tienen ambientes precarios para estudiar. En la reunión con los alcaldes, Martens conversó sobre la importancia de la educación. ""Se trata de atender y ver las necesidades, y orientar a los alcaldes para poder implementar proyectos de inversión con vías a mejorar la calidad educativa y de que todos los actores se involucren. Un ejemplo del trabajo que hemos realizado es que en Huancavelica Apurímac y Ayacucho, regiones con mayor indice de pobreza, se ha alcanzado entre 17 y 18 puntos porcentuales de logros en aprendizaje"", dijo Martens, en declaraciones a la prensa. La titular del sector, Marilú Martens, destacó hoy en Iquitos (Loreto) que este año el Estado invertirá 225 millones 807 mil 337 soles en la formación de 6 mil 700 estudiantes que representan a todas las regiones del país. ""El año pasado se ejecutaron 153 millones 547 mil 353 soles a favor de 4 mil 360 estudiantes y ahora el presupuesto es mayor porque la Red atiende a 2 mil 340 alumnos más"", explicó la ministra de Educación durante su visita al Colegio de Alto Rendimiento (COAR) de Loreto en compañía del presidente Pedro Pablo Kuczynski y el ministro de Economía, Alfredo Thorne. Martens subrayó que en el caso de las regiones amazónicas de Loreto, Amazonas, Madre de Dios, San Martín y Ucayali la partida presupuestal de estos COAR se ha elevado de S/ 23.6 millones en 2016 a S/ 36.1 millones en 2017, en beneficio de 1.128 escolares. Indicó que el Estado invierte en cada alumno de alto desempeño un promedio de 31 mil 932 soles por año, monto que cubre servicios pedagógicos, acompañamiento socioemocional, Programa Diploma del Bachillerato Internacional, programas integrados como Adaptación, Liderazgo y Plan de vida; además de servicios complementarios como vivienda y alimentación, entre otros. Durante la visita, los alumnos presentaron a las autoridades un prototipo de robot que puede cosechar aguaje sin necesidad de que se talen árboles y que participará en una competencia internacional. La ministra precisó que de los 2055 egresados de los COAR, el 99% está cursando estudios superiores o está por concluirlos, el 3% de ellos en el extranjero. La ministra Martens invitó a todos los estudiantes de Loreto a postular al Programa Beca 18 que este año ofrecerá 4 mil becas integrales para realizar estudios superiores. En ese sentido, destacó que este año el proceso de evaluación es más simple y beneficia a los damnificados de las zonas de emergencia con un puntaje adicional. Puntualizó que durante los últimos cinco años, 2 mil 281 jóvenes loretanos han sido beneficiados con la Beca 18, lo que les permite estudiar en destacados institutos y universidades del país. Las postulaciones pueden realizarse del 31 de marzo al 30 de abril y del 1 de mayo al 2 de junio, a través del portal web del Programa Nacional de Becas y Crédito Educativo (Pronabec). PPK se reúne con alcaldes de Loreto, Amazonas, Madre de Dios, San Martín y Ucayali [EN VIVO] https://t.co/CJd5tWjFtU pic.twitter.com/YzIeqhHcNO — Diario Perú21 (@peru21noticias) 28 de abril de 2017",https://peru21.pe/lima/ministra-educacion-invita-estudiantes-iquitos-postular-programa-beca-18-74389
Beca 18 dejará de tomar examen de conocimiento a postulantes,Modificación aplicará desde el 2018 y considerará las habilidades múltiples.,23/04/2017 16:50h," Beca 18 dejará de tomar el examen de conocimiento a sus postulantes a partir del 2018 y optará por una prueba de talento que medirá las habilidades sociales y las inteligencias múltiples, informó Marushka Chocobar, jefa del Programa Nacional de Becas y Crédito Educativo ( Pronabec ). Indicó que anteriormente la prueba se centraba solamente en el rendimiento académico de los estudiantes que había concluido sus estudios secundarios y desean desarrollar una carrera superior. Asimismo, Chocobar refirió que se está diseñando una prueba que evalúe el potencial de los postulantes, así como sus habilidades para diferentes materias, su capacidad para trabajar en grupo y las habilidades sociales. ""Tenemos que diseñar exámenes que en cierta medida nos aseguren el éxito del aprovechamiento de la beca"", explicó a la agencia Andina.",https://peru21.pe/lima/beca-18-dejara-examen-conocimiento-postulantes-73751
Minedu ofrece 4 mil becas integrales para educación superior,"A través de Pronabec, el ministerio promueve educación de calidad para jóvenes de alto rendimiento educación y que estén en situación de pobreza.",22/04/2017 06:59h," El *Ministerio de Educación (Minedu) ofrecerá 4 mil becas integrales mediante el Programa Beca 18 , que este año se ha renovado para simplificar y facilitar el proceso de postulación con el fin de llegar a más jóvenes peruanos, incluso a los que están en zonas de emergencia. De esta manera, el Minedu, a través del Programa Nacional de Becas y Crédito Educativo (Pronabec), continúa promoviendo el acceso a una educación superior de calidad para jóvenes de hasta 22 años con alto rendimiento académico y que se encuentran en situación de pobreza. Marushka Chocobar, directora ejecutiva del Pronabec, explicó que esta vez, a diferencia de otros años, el aspirante solo deberá presentar cuatro documentos y dará el examen de la institución superior que participa en esta convocatoria y no el examen único nacional, como se hacía antes. Cobertura total Para promover que los becarios estudien en sus regiones y luego apliquen lo aprendido en su comunidad, Beca 18 asignará mayor puntaje en la evaluación a aquellos que elijan estudiar en una universidad o instituto de su región. La beca cubre los costos académicos (10 semestres para universidad y 6 para instituto), transporte, alimentación, seguro de salud SIS, materiales de estudio y alojamiento si se elige una región diferente al lugar de residencia. Los aspirantes a *Beca 18 *podrán realizar sus trámites para postular en dos periodos: del 31 de marzo al 30 de abril y del 1 de mayo al 2 de junio. De este modo, tendrán más posibilidades pues en cada periodo la oferta es de dos mil becas. Los interesados pueden revisar las bases y las universidades e institutos superiores elegibles en www.pronabec.gob.pe",https://peru21.pe/lima/minedu-ofrece-4-mil-becas-integrales-educacion-superior-73626
¿Quieres estudiar en el extranjero? Hay 130 becas para maestrías y doctorados,Conoce los requisitos del Ministerio de Educación para poder participar en la convocatoria.,06/04/2017 15:57h," El Ministerio de Educación del Perú, a través del Programa Nacional de Becas y Crédito Educativo (PRONABEC), ha convocado al Concurso Público de la ""Beca Presidente de la República"" para realizar estudios de Maestría o Doctorado en universidades extranjeras. Las 130 becas están dirigidas a profesionales peruanos con residencia en el Perú y busca la profundización de los conocimientos obtenidos en la educación superior, así como fomentar la investigación científica y la innovación tecnológica. La convocatoria se extiende hasta el 2 de mayo de 2017. Si desea más información puede ingresar *acá*http://www.pronabec.gob.pe/2017_BecaPresidente.php",https://peru21.pe/lima/quieres-estudiar-extranjero-hay-130-becas-maestrias-doctorados-71863
Perú e Irlanda acordaron fortalecer la cooperación bilateral,Mandatarios de ambos países firmaron un memorándum de entendimiento para estrechar lazos.,11/02/2017 07:25h," El presidente del Perú, Pedro Pablo Kuczynski , y su homólogo de Irlanda , Michael D. Higgins, acordaron fortalecer la cooperación bilateral entre ambos países. Para ello, los mandatarios firmaron –luego de reunirse en Palacio de Gobierno– un memorándum de entendimiento para estrechar lazos ante la próxima apertura de una embajada de Perú en Dublín. Asimismo, el memorándum establece un mecanismo de consultas políticas, asuntos bilaterales, regiones y multilaterales de interés común. Como parte de los acuerdos, ambos países firmaron, además, un convenio entre el Programa Nacional de Becas (Pronabec) del Perú y la Universidad College de Cork, de Irlanda, para subvencionar a los estudiantes peruanos en diversos programas, como los de desarrollo tecnológico y científico que se ofrecen en el país irlandés.",https://peru21.pe/economia/peru-e-irlanda-acordaron-fortalecer-cooperacion-bilateral-66030
Ingeniero peruano ocupó primer puesto en maestría cursada en Universidad de Manchester,Aníbal Tafur Gutiérrez desarrolló una innovadora manera de que los puentes puedan ser más resistentes ante movimientos telúricos.,21/01/2017 19:37h," No todos los días se obtiene un primer puesto en una maestría. Y más aun, si esta es cursada fuera de tu país. Aníbal Tafur Gutiérrez es peruano y es de aquellas personas que pueden lograr tales proezas académicas. Él es ingeniero civil egresado de la Pontificia Universidad Católica del Perú y sus sueños lo impulsaron a seguir creciendo profesionalmente. Fue por ello que decidió cursar una maestría en la Universidad de Manchester, en Inglaterra. ¿Pero cuál fue la idea con la cual Tafur Gutiérrez —uno de los beneficiados del programa Pronobec— pudo obtener el primer puesto en esta prestigiosa casa de estudios y que es considerada dentro de las 33 mejores universidades del mundo? Todo inició cuando un terremoto de magnitud 7.9 en la escala de Ritcher azotó la ciudad de Pisco (región Ica) en 2007 y dejó varias viviendas colapsadas. A nuestro compatriota, oriundo de Amazonas, se le ocurrió la gran idea de pensar cómo hacer más resistentes estas estructuras ante temblores. Fue así que diseñó una ingeniosa propuesta. Su estudio propone el reforzamiento del puente usando aisladores sísmicos de caucho, con lo que se lograría que estructuras similares puedan resistir los movimientos telúricos de similar e incluso mayor magnitud al registrado en la ciudad de Pisco. El proyecto de Tafur Gutiérrez fue muy elogiado por los profesores de la Universidad de Manchester. Justamente, uno de los docentes quienes le ensañaron al peruano fue el Dr. Adrian Bell, ingeniero británico quien diseñó el Ojo de Londres.",https://peru21.pe/lima/ingeniero-peruano-ocupo-primer-puesto-maestria-cursada-universidad-manchester-62790
Saramurillo: El conflicto que acabó en fiesta gracias a la voluntad política de entendimiento,Escuchar y empatía. Esto que puede resultar simple y cotidiano fue la clave del éxito en la resolución de este caso que llevaba 115 días entrampado.,17/12/2016 15:02h," A la medianoche del último viernes 16, la comunidad indígena de Saramurillo , de Loreto, estalló en fiesta, tras llegar a importantes y bilaterales acuerdos, 6 en total, con los representantes del gobierno, liderados por el ministro de la Producción, Bruno Giuffra . – El cierre de esta negociación llegó después de 115 días en los cuales el Poder Ejecutivo no lograba resolver este conflicto político y social con las comunidades nativas de Loreto, por el caso del derramamiento de petróleo en el Oleoducto Norperuano. La única arma que se utilizó fue la del del diálogo abierto con fines de entendimiento: _ ""La resolución de este conflicto en base al diálogo marca un hito en nuestro país donde, lamentablemente, gobiernos anteriores optaron por la imposición o la represión. Esta vez, llegamos a 6 acuerdos sin derramamiento de sangre y con mucha voluntad de entendimiento ""_, dice el ministro Bruno Giuffra en entrevista con Perú21. Para los líderes de las comunidades nativas de las cuencas de los ríos Pastaza, Corrientes, Tigre, Marañón y Chambira, en Saramurillo, Loreto, además de la remediación de la zona, tras los derrames de petróleo, solicitaron la compensación de los daños a través de proyectos de infraestructura, inversión en educación, en obras de saneamiento, salud, e inversión en alternativas económicas que no dependan de la actividad petrolera. ""Por ejemplo, fortalecer el turismo, promover el desarrollo de productos locales para insertarlos en las cadenas productivas, como el camu camu. También el desarrollo de la acuicultura, que es un tema que se le pondrá mucha atención desde el Ejecutivo"", sostuvo el titular de Produce. El ministro Giuffra informó que desde la Presidencia del Consejo de Ministros hay un compromiso directo para acortar también las brechas en educación, salud y saneamiento. ""Lo más importante de esta negociación es que se ha logrado establecer un vínculo directo , de entendimiento y empatía con las comunidades afectadas, lo que es clave en la solución de este tipo de conflictos sociales"", puntualizó el ministro. El diálogo transcurrió así: Apu: ""Señor Ministro, cuando uno de sus jóvenes ingresa a la Universidad, se alegra toda su familia. Pero cuando logra ingresar uno de los nuestros siembra esperanza en todo su pueblo!"" (Momento del debate sobre acceso a la educación en Saramurillo), tomado del muro de Marco Antonio Huaco Palomino, miembro de la comitiva de negociación, representante de la congresista del Frente Amplio, María Elena Foronda, Presidenta de la Comisión de Pueblos Andinos, Amazónicos y Afroperuanos, Medio Ambiente y Ecología. ""Ahora sigue la etapa de la implementación de los acuerdos, pues esta firma marca solo el inicio de todo este proceso, pero tenemos la certeza de que será exitoso porque hemos iniciado bien, con un adecuado entendimiento con las comunidades, que por décadas han estado postergadas y porque el Ejecutivo tiene la voluntad política de concretar todo lo pactado en Saramurillo"", concluyó el ministro Bruno Giuffra.",https://peru21.pe/politica/saramurillo-conflicto-acabo-fiesta-gracias-voluntad-politica-entendimiento-236135
Otorgarán becas para que jóvenes de todo el país culminen educación secundaria,"Pronabec beneficiará a 250 personas que residen en zonas de alto riesgo en Lima, La Libertad e Ica.",04/12/2016 12:55h," El Ministerio del Interior (Mininter) y el ""Programa Nacional de Becas y Crédito Educativo (Pronabec ) "":http://peru21.pe/noticias-de-pronabec-57999 ofrecerán becas a jóvenes de diferentes regiones del Perú, beneficiarios del programa Barrio Seguro, para que culminen su secundaria, sigan una carrera técnica y se puedan insertar laboralmente en los sectores productivos del país. Juan Reátegui Ballón, representante de Pronabec, explicó que para el 2017 se ha contemplado destinar 250 becas Doble Oportunidad para estos jóvenes que no han terminado su secundaria y que residen en zonas donde existe violencia, pandillaje, pobreza y deserción escolar. Para acceder a las becas, explicó, estos jóvenes deben tener entre 17 y 25 años de edad y haber terminado, como mínimo, el tercer año de secundaria o el segundo de básica regular. Asimismo, deben rendir una evaluación aptitudinal para evidenciar que estos jóvenes cuentan con una performance adecuada para poder rendir en la beca. ""Todas las becas del Pronabec siempre apuntan a tratar de ubicar el talento aún cuando provengan de barrios inseguros por la delincuencia. Se espera que haya una base académica para poder rendir"", manifestó Reátegui en declaraciones a la agencia Andina. Adelantó que en una segunda etapa se ha contemplado ofrecer estas becas en otras 25 zonas de Barrio Seguro, entre los que se cuenta a la provincia del Callao. Explicó que los cursos para completar un año de secundaria son de dos horas diarias durante 8 meses y se imparten de manera virtual, y que además los beneficiarios reciben alimentación, movilidad y material educativo de manera gratuita. ""Ellos pueden estudiar porque tienen una subvención mensual de 750 soles, con la cual se les paga los estudios"", anotó. El costo promedio por becario de Doble Oportunidad (gracias a la cual culmina sus estudios escolares inconclusos y estudia una carrera técnica) es de 12,000 soles. Pronabec es una de las instituciones que participan en el programa multisectorial Barrio Seguro que lidera el Ministerio del Interior (Mininter) y que busca intervenir en aquellas zonas identificadas de extrema pobreza en el Censo Especial de Población y Vivienda que realiza el Instituto Nacional de Estadística e Informática (INEI).",https://peru21.pe/lima/otorgaran-becas-jovenes-pais-culminen-educacion-secundaria-235013
Director de Pronabec acudirá a la Comisión de Educación del Congreso para explicar 'donación' de laptops,"En dicho grupo de trabajo también se presentará la titular de la Sunedu, para explicar la problemática de su sector.",13/11/2016 17:32h," Este lunes, a las 10 de la mañana, el director ejecutivo del Programa Nacional de Becas y Crédito Educativo ( Pronabec ), Sergio Bravo Cucci, deberá presentarse ante la Comisión de Educación de Educación del Congreso para explicar la 'donación' de 75 laptops a dos colegios del cerro San Cosme, que en realidad resultaron ser solo carcasas. Su presencia ante el grupo que presidente el congresista Lucio Ávila se da luego de la denuncia del dominical Panorama, el cual dio a conocer que las instituciones José Martí y Rosa de América recibieron máquinas que no contaban con disco duro y que, en muchos casos, solo se trataba de pantallas rotas y teclados. [Pronabec 'donó' 75 laptops a 2 colegios ubicados en el cerro San Cosme, pero estas resultaron ser solo carcasas] Cabe señalar que Pronabec, tras tomar cuenta del caso, reestructuró su Unidad de Control Patrimonial, y removió a 4 servidores públicos de sus funciones. A este grupo de trabajo también se presentará la titular de la Superintendencia Nacional de Educación Superior Universitaria (Sunedu), Lorena Masías Quiroga, para exponer la problemática de su sector.",https://peru21.pe/politica/director-pronabec-acudira-comision-educacion-congreso-explicar-donacion-laptops-233244
